{
  "schema": "semantic-display/v1",
  "name": "Remote test configuration",
  "permanent_sources": [
    {
      "id": "outside-temperature-history",
      "provider": "signalk",
      "path": "environment.outside.temperature",
      "unit": "K",
      "subscribe": { "period_ms": 1000 },
      "history": {
        "interval_ms": 60000,
        "points": 120,
        "reducer": "mean"
      }
    }
  ],
  "sections": [
    {
      "id": "navigation",
      "title": "Navigation",
      "button_labels": { "action_2": "REFRESH" },
      "sources": [
        {
          "id": "sog",
          "provider": "signalk",
          "path": "navigation.speedOverGround",
          "unit": "m/s",
          "subscribe": { "period_ms": 500 },
          "stale_ms": 5000
        },
        {
          "id": "cog",
          "provider": "signalk",
          "path": "navigation.courseOverGroundTrue",
          "unit": "rad",
          "subscribe": { "period_ms": 500 },
          "stale_ms": 5000
        },
        {
          "id": "depth",
          "provider": "signalk",
          "path": "environment.depth.belowTransducer",
          "unit": "m",
          "subscribe": { "period_ms": 1000 },
          "stale_ms": 10000
        }
      ],
      "pages": [
        {
          "id": "overview",
          "title": "Overview",
          "grid": { "columns": 3, "rows": 3, "gap": 4 },
          "widgets": [
            {
              "type": "value",
              "source": "sog",
              "cell": { "column": 0, "row": 0, "column_span": 2, "row_span": 3 },
              "label": "SOG",
              "display_unit": "kn",
              "decimals": 1
            },
            {
              "type": "value",
              "source": "cog",
              "cell": { "column": 2, "row": 0 },
              "label": "COG",
              "display_unit": "deg",
              "decimals": 0
            },
            {
              "type": "value",
              "source": "depth",
              "cell": { "column": 2, "row": 1 },
              "label": "DEPTH",
              "display_unit": "m",
              "decimals": 1
            },
            {
              "type": "local-clock",
              "cell": { "column": 2, "row": 2 },
              "label": "LOCAL"
            }
          ]
        },
        {
          "id": "course",
          "title": "Course",
          "grid": { "columns": 2, "rows": 2, "gap": 4 },
          "widgets": [
            {
              "type": "value",
              "source": "cog",
              "cell": { "column": 0, "row": 0, "column_span": 2 },
              "label": "COURSE OVER GROUND",
              "display_unit": "deg",
              "decimals": 0
            },
            {
              "type": "future-wind-compass",
              "cell": { "column": 0, "row": 1, "column_span": 2 }
            }
          ]
        }
      ]
    },
    {
      "id": "system",
      "title": "System",
      "button_labels": { "action_2": "REFRESH" },
      "sources": [
        {
          "id": "voltage",
          "provider": "signalk",
          "path": "electrical.batteries.house.voltage",
          "unit": "V",
          "subscribe": { "period_ms": 1000 }
        }
      ],
      "pages": [
        {
          "id": "status",
          "title": "Device status",
          "grid": { "columns": 2, "rows": 2, "gap": 4 },
          "widgets": [
            {
              "type": "text",
              "cell": { "column": 0, "row": 0, "column_span": 2 },
              "text": "SEMANTIC BOAT REMOTE"
            },
            {
              "type": "local-clock",
              "cell": { "column": 0, "row": 1 },
              "label": "DEVICE TIME"
            },
            {
              "type": "value",
              "source": "voltage",
              "cell": { "column": 1, "row": 1 },
              "label": "HOUSE",
              "display_unit": "V",
              "decimals": 1
            }
          ]
        },
        {
          "id": "history",
          "title": "History",
          "history_plot": {
            "source": "outside-temperature-history",
            "title": "OUTSIDE TEMPERATURE",
            "display_unit": "C",
            "decimals": 1
          },
          "grid": { "columns": 1, "rows": 1, "gap": 0 },
          "widgets": [
            {
              "type": "value",
              "source": "outside-temperature-history",
              "label": "OUTSIDE",
              "display_unit": "C",
              "decimals": 1,
              "cell": { "column": 0, "row": 0 }
            }
          ]
        }
      ]
    }
  ]
}
